{
  "schema_version": 1,
  "record_type": "SIMULATED_FILL",
  "record_id": "ba1c8ab4c208b75ec1cc263d6dda91548ddf64d33b17942414b82b8419b6f39f",
  "recorded_at": "2026-09-23T09:16:00Z",
  "manifest_id": "fdcc1c5b32bd008d976c20671af67384bc0d595cc4b0f8f84691ee9b0d412ff3",
  "decision_id": "dce50c5b0a2c42ea578ec412f7a6a648fc4572b7809dcb2caf21a55b366e0692",
  "trade_id": "ac411887f3daec8d3f9723bc972e2d48b371477b02b7d7c08565526a8dd90013",
  "fill_role": "ENTRY",
  "sequence": 0,
  "symbol": "XAUUSD",
  "side": "BUY",
  "filled_at": "2026-09-23T09:15:00Z",
  "timing_basis": "BAR_OPEN",
  "reference_price": 100.0,
  "fill_price": 100.0,
  "quantity_lots": 0.1,
  "contract_size": 100.0,
  "embedded_spread_amount": 0.0,
  "embedded_slippage_amount": 0.0,
  "commission_amount": 0.0,
  "swap_amount": 0.0,
  "account_currency": "USD",
  "cost_model_version": "fixture-zero-cost-v1",
  "initial_risk_amount": 20.0
}
